{
  "schema": "canvasbench.manifest.v2",
  "suite_id": "canvasbench-v2-orchestrated-20260725",
  "threshold": 90,
  "cases": [
    {"id": "case-02", "task_file": "tasks/case-02.json", "sha256": "ff5365de257a4afc36f92a4ff9deec514cdb432ca760286ab6aafc642e9a239d", "weight": 7, "status": "runnable", "hard_gate": false},
    {"id": "case-03", "task_file": "tasks/case-03.json", "sha256": "57a1e607d35c29bed6232d2d35daaf7de3f3f5152a4afb34ec9d241d406d63e1", "weight": 7, "status": "runnable", "hard_gate": false},
    {"id": "case-04", "task_file": "tasks/case-04.json", "sha256": "82c400c8f2ee706ff83c1ad9a56c1dd2166594f2104c2a5ea1d36914b2ec4c94", "weight": 14, "status": "runnable", "hard_gate": true},
    {"id": "case-05", "task_file": "tasks/case-05.json", "sha256": "4d9254ae902aa7252747da983141853cfacb65e13166cbad96671cf3fbc06547", "weight": 16, "status": "runnable", "hard_gate": true},
    {"id": "case-06", "task_file": "tasks/case-06.json", "sha256": "3d6904d8c2b1d659c31835a45ac8404e2efd1a243b35d4fe0681d336d1faac78", "weight": 14, "status": "runnable", "hard_gate": true},
    {"id": "case-07", "task_file": "tasks/case-07.json", "sha256": "3190e911ce27fbd471c177b9c8a3b20504060b85cc31dc3a3ef3a412f8b4fe40", "weight": 8, "status": "runnable", "hard_gate": false},
    {"id": "case-08", "task_file": "tasks/case-08.json", "sha256": "7e5f349f056e12e0cb8904e93129d7a7fb010d1d438375777608302c2de0e9b1", "weight": 10, "status": "runnable", "hard_gate": true}
  ]
}
