{
  "schema": "canvasbench.manifest.v2",
  "suite_id": "canvasbench-v2-agent-discriminator-20260725",
  "threshold": 90,
  "cases": [
    {
      "id": "case-01",
      "task_file": "tasks/case-01.json",
      "sha256": "edecbf539cd10f9814002e5d12214154ca0d1e7d3a23fd4594941ede863dc90d",
      "weight": 8,
      "status": "runnable",
      "hard_gate": false
    },
    {
      "id": "case-02",
      "task_file": "tasks/case-02.json",
      "sha256": "ff5365de257a4afc36f92a4ff9deec514cdb432ca760286ab6aafc642e9a239d",
      "weight": 7,
      "status": "runnable",
      "hard_gate": false
    },
    {
      "id": "case-03",
      "task_file": "tasks/case-03.json",
      "sha256": "57a1e607d35c29bed6232d2d35daaf7de3f3f5152a4afb34ec9d241d406d63e1",
      "weight": 7,
      "status": "runnable",
      "hard_gate": false
    },
    {
      "id": "case-07",
      "task_file": "tasks/case-07.json",
      "sha256": "3190e911ce27fbd471c177b9c8a3b20504060b85cc31dc3a3ef3a412f8b4fe40",
      "weight": 8,
      "status": "runnable",
      "hard_gate": false
    }
  ]
}
